{
  "schema_version": "1.0",
  "entries": [
    {
      "operation_id": "uapi:DNS/fetch_cpanel_generated_domains",
      "variant_id": "uapi:DNS/fetch_cpanel_generated_domains#GET",
      "symbol": "HostingPal\\WhmApiClient\\Api\\Uapi\\Dns::generatedDomains",
      "status": "implemented",
      "tests": [
        "HostingPal\\WhmApiClient\\Tests\\Api\\UapiInventoryTest::testBridgeGroupsKeepTargetsAndMetadataIsolated",
        "HostingPal\\WhmApiClient\\Tests\\Api\\UapiInventoryTest::testInventoryOperationsPreservePayloadAndRequestAccount",
        "HostingPal\\WhmApiClient\\Tests\\Api\\UapiInventoryTest::testMalformedPayloadRetainsCurrentEnvelopeMetadata",
        "HostingPal\\WhmApiClient\\Tests\\Live\\InventoryLiveTest::testUapiInventory"
      ],
      "contract_units": [
        {
          "id": "[\"uapi:DNS/fetch_cpanel_generated_domains#GET\",\"parameter\",\"domain\",\"query\"]",
          "hash": "961c865fb35491f6d0ca14e8f93b4b0f4f70a417cc762ec9d7fb92aaa81b4413",
          "tests": [
            "HostingPal\\WhmApiClient\\Tests\\Api\\UapiInventoryTest::testInventoryOperationsPreservePayloadAndRequestAccount"
          ]
        },
        {
          "id": "[\"uapi:DNS/fetch_cpanel_generated_domains#GET\",\"response\",\"200\",\"application/json\"]",
          "hash": "4d73cb9f4399759bd0cd164a3b92bb3b026be63b9d35cd112e42be123d0c86ff",
          "tests": [
            "HostingPal\\WhmApiClient\\Tests\\Api\\UapiInventoryTest::testBridgeGroupsKeepTargetsAndMetadataIsolated",
            "HostingPal\\WhmApiClient\\Tests\\Api\\UapiInventoryTest::testInventoryOperationsPreservePayloadAndRequestAccount",
            "HostingPal\\WhmApiClient\\Tests\\Api\\UapiInventoryTest::testMalformedPayloadRetainsCurrentEnvelopeMetadata",
            "HostingPal\\WhmApiClient\\Tests\\Live\\InventoryLiveTest::testUapiInventory"
          ]
        }
      ],
      "live_evidence_ids": [],
      "mapping_group": "account-inventory-read-only-slice",
      "mapping_rationale": "The account-scoped method implements this reviewed read-only UAPI operation through direct cPanel-token or internal WHM-token routing. UapiInventoryTest successfulOperations datasets generated, generated empty cover each route and concrete return; invalidPayloads has the matching operation dataset. Parameter validation conditions remain upstream API decisions. Live declarations exercise this operation through each credential route; no saved revision-bound live outcomes, generic bridge coverage, or BasicAuth implementation are claimed."
    },
    {
      "operation_id": "uapi:DNS/lookup",
      "variant_id": "uapi:DNS/lookup#GET",
      "symbol": "HostingPal\\WhmApiClient\\Api\\Uapi\\Dns::lookup",
      "status": "implemented",
      "tests": [
        "HostingPal\\WhmApiClient\\Tests\\Api\\UapiInventoryTest::testDnsLookupRejectsMissingDataInsteadOfReturningExplicitNull",
        "HostingPal\\WhmApiClient\\Tests\\Api\\UapiInventoryTest::testInventoryOperationsPreservePayloadAndRequestAccount",
        "HostingPal\\WhmApiClient\\Tests\\Api\\UapiInventoryTest::testMalformedPayloadRetainsCurrentEnvelopeMetadata",
        "HostingPal\\WhmApiClient\\Tests\\Api\\UapiInventoryTest::testTransportFailureClearsMetadataWithoutRetry",
        "HostingPal\\WhmApiClient\\Tests\\Live\\InventoryLiveTest::testUapiInventory"
      ],
      "contract_units": [
        {
          "id": "[\"uapi:DNS/lookup#GET\",\"parameter\",\"domain\",\"query\"]",
          "hash": "7660d66ffd75a9cee033c6c1b0ec78ca37ffffd3f0247d92e1878e5e4aa26ed8",
          "tests": [
            "HostingPal\\WhmApiClient\\Tests\\Api\\UapiInventoryTest::testInventoryOperationsPreservePayloadAndRequestAccount"
          ]
        },
        {
          "id": "[\"uapi:DNS/lookup#GET\",\"response\",\"200\",\"application/json\"]",
          "hash": "95c20a403cac69dbed3bb7c07a7072fb73cef3704da99421c646593808a94168",
          "tests": [
            "HostingPal\\WhmApiClient\\Tests\\Api\\UapiInventoryTest::testDnsLookupRejectsMissingDataInsteadOfReturningExplicitNull",
            "HostingPal\\WhmApiClient\\Tests\\Api\\UapiInventoryTest::testInventoryOperationsPreservePayloadAndRequestAccount",
            "HostingPal\\WhmApiClient\\Tests\\Api\\UapiInventoryTest::testMalformedPayloadRetainsCurrentEnvelopeMetadata",
            "HostingPal\\WhmApiClient\\Tests\\Live\\InventoryLiveTest::testUapiInventory"
          ]
        }
      ],
      "live_evidence_ids": [],
      "mapping_group": "account-inventory-read-only-slice",
      "mapping_rationale": "The account-scoped method implements this reviewed read-only UAPI operation through direct cPanel-token or internal WHM-token routing. UapiInventoryTest successfulOperations datasets lookup, lookup null, lookup empty cover each route and concrete return; invalidPayloads has the matching operation dataset. Parameter validation conditions remain upstream API decisions. Live declarations exercise this operation through each credential route; no saved revision-bound live outcomes, generic bridge coverage, or BasicAuth implementation are claimed."
    },
    {
      "operation_id": "uapi:DomainInfo/list_domains",
      "variant_id": "uapi:DomainInfo/list_domains#GET",
      "symbol": "HostingPal\\WhmApiClient\\Api\\Uapi\\Domains::list",
      "status": "implemented",
      "tests": [
        "HostingPal\\WhmApiClient\\Tests\\Api\\ReadOnlySliceTest::testBridgeRetainsBothEnvelopesAndSelectedAccountIsolation",
        "HostingPal\\WhmApiClient\\Tests\\Api\\ReadOnlySliceTest::testDirectDomainsAcceptObservedHttpEnvelope",
        "HostingPal\\WhmApiClient\\Tests\\Api\\ReadOnlySliceTest::testDirectDomainsUseCpanelCredentialsAndPreserveFilterOmission",
        "HostingPal\\WhmApiClient\\Tests\\Api\\ReadOnlySliceTest::testFailuresReplaceOldMetadataAndKeepExceptionSnapshot",
        "HostingPal\\WhmApiClient\\Tests\\Live\\ReadOnlyOperationsTest::testBridgedAccountDomains",
        "HostingPal\\WhmApiClient\\Tests\\Live\\ReadOnlyOperationsTest::testDirectAccountDomains",
        "HostingPal\\WhmApiClient\\Tests\\Response\\AccountDomainsTest::testCopiesMutablePayloadsAndNestedReferencesIntoAnIndependentSnapshot",
        "HostingPal\\WhmApiClient\\Tests\\Response\\AccountDomainsTest::testKeepsOmittedFieldsDistinctFromExplicitNullAndEmptyValues",
        "HostingPal\\WhmApiClient\\Tests\\Response\\AccountDomainsTest::testMapsTheReviewedDomainFieldsAndIgnoresUnknownExtensions",
        "HostingPal\\WhmApiClient\\Tests\\Response\\AccountDomainsTest::testPreservesBlankDomainValuesFromSuccessfulButIncompleteResponses",
        "HostingPal\\WhmApiClient\\Tests\\Response\\AccountDomainsTest::testRejectsMalformedKnownFieldsWithTheResponseSnapshot"
      ],
      "contract_units": [
        {
          "id": "[\"uapi:DomainInfo/list_domains#GET\",\"parameter\",\"hide_temporary_domains\",\"query\"]",
          "hash": "e0628eb60a6c42bfe8e0b0020423145742a7e180d51185928c6ee94d7d1141dc",
          "tests": [
            "HostingPal\\WhmApiClient\\Tests\\Api\\ReadOnlySliceTest::testBridgeRetainsBothEnvelopesAndSelectedAccountIsolation",
            "HostingPal\\WhmApiClient\\Tests\\Api\\ReadOnlySliceTest::testDirectDomainsUseCpanelCredentialsAndPreserveFilterOmission"
          ]
        },
        {
          "id": "[\"uapi:DomainInfo/list_domains#GET\",\"response\",\"200\",\"application/json\"]",
          "hash": "e1d4fa0d705e701f129692395f56107c1d1718e73d011a79bfb0da3ea2b2c670",
          "tests": [
            "HostingPal\\WhmApiClient\\Tests\\Api\\ReadOnlySliceTest::testBridgeRetainsBothEnvelopesAndSelectedAccountIsolation",
            "HostingPal\\WhmApiClient\\Tests\\Api\\ReadOnlySliceTest::testDirectDomainsAcceptObservedHttpEnvelope",
            "HostingPal\\WhmApiClient\\Tests\\Api\\ReadOnlySliceTest::testDirectDomainsUseCpanelCredentialsAndPreserveFilterOmission",
            "HostingPal\\WhmApiClient\\Tests\\Api\\ReadOnlySliceTest::testFailuresReplaceOldMetadataAndKeepExceptionSnapshot",
            "HostingPal\\WhmApiClient\\Tests\\Live\\ReadOnlyOperationsTest::testBridgedAccountDomains",
            "HostingPal\\WhmApiClient\\Tests\\Live\\ReadOnlyOperationsTest::testDirectAccountDomains",
            "HostingPal\\WhmApiClient\\Tests\\Response\\AccountDomainsTest::testCopiesMutablePayloadsAndNestedReferencesIntoAnIndependentSnapshot",
            "HostingPal\\WhmApiClient\\Tests\\Response\\AccountDomainsTest::testKeepsOmittedFieldsDistinctFromExplicitNullAndEmptyValues",
            "HostingPal\\WhmApiClient\\Tests\\Response\\AccountDomainsTest::testMapsTheReviewedDomainFieldsAndIgnoresUnknownExtensions",
            "HostingPal\\WhmApiClient\\Tests\\Response\\AccountDomainsTest::testPreservesBlankDomainValuesFromSuccessfulButIncompleteResponses",
            "HostingPal\\WhmApiClient\\Tests\\Response\\AccountDomainsTest::testRejectsMalformedKnownFieldsWithTheResponseSnapshot"
          ]
        }
      ],
      "live_evidence_ids": [],
      "mapping_group": "account-domains-read-only-slice",
      "mapping_rationale": "The typed account-scoped method implements the reviewed DomainInfo/list_domains parameter and full response-envelope contracts using direct cPanel-token or internal WHM-token bridge routing. This does not claim generic uapi_cpanel implementation, BasicAuth support, or saved revision-bound live evidence."
    },
    {
      "operation_id": "uapi:DomainInfo/main_domain_builtin_subdomain_aliases",
      "variant_id": "uapi:DomainInfo/main_domain_builtin_subdomain_aliases#GET",
      "symbol": "HostingPal\\WhmApiClient\\Api\\Uapi\\Domains::builtinAliases",
      "status": "implemented",
      "tests": [
        "HostingPal\\WhmApiClient\\Tests\\Api\\UapiInventoryTest::testInventoryOperationsPreservePayloadAndRequestAccount",
        "HostingPal\\WhmApiClient\\Tests\\Api\\UapiInventoryTest::testMalformedPayloadRetainsCurrentEnvelopeMetadata",
        "HostingPal\\WhmApiClient\\Tests\\Live\\InventoryLiveTest::testUapiInventory"
      ],
      "contract_units": [